RIC;ISIN;CUSIP;Company;Country;Sector;Group;alarm_bell_start_date;alarm_bell_end_date;comments
5201.T;JP3112000009;J0025W100;AGC Inc;Japan;Industrials;Capital Goods;13-05-2024;13-05-2025;"Official ruling for gender discrimination [AGC Inc is the parent company of AGC Green-Tech Co.] - ""Court: Company housing system discriminates against women
The Tokyo District Court on May 13 ruled that a company’s housing system, which offers substantially better benefits to “career-track” employees, discriminates against women. The lawsuit was filed by a woman who works at AGC Green-Tech Co., a subsidiary of AGC Inc., which is a major glass manufacturer formerly called Asahi Glass Co. The woman claimed that she was subjected to gender discrimination by the company’s housing and wages policy based on the idea that “sogo-shoku” (career-track positions) are for men and “ippan-shoku” (general positions) are for women. The court ordered AGC Green-Tech to pay a total of 3.78 million yen ($24,250) to the woman, who is a general position employee. “There is no rational reason for limiting the company housing system to career-track employees,” the court said in the ruling. The court found that the situation “constitutes indirect discrimination” under the Equal Employment Opportunity Law and that “it is illegal for the company to continue to operate the company housing system without correcting the indirect discrimination.” According to the complaint and other documents, the Tokyo-based company’s career-track positions are almost exclusively occupied by men, while the general positions are almost exclusively held by women."" https://www.asahi.com/ajw/articles/15264795"
SNAP.N;US83304A1060;83304A106;Snap Inc;United States of America;Communication Services;Media & Entertainment;19-06-2024;19-06-2025;"Settlement for Gender Discrimination & Harassment - """"The California Civil Rights Department has revealed that Snap Inc. has agreed to pay $15 million to settle the lawsuit it filed """"over alleged discrimination, harassment, and retaliation against women at the company."""" California's civil rights agency started investigating the company behind Snapchat over three years ago due to claims that it discriminated and retaliated against female employees. The agency accused the company of failing the make sure that female employees were paid equally despite a period of rapid growth between 2015 to 2022.
Women, especially those in engineering roles, were allegedly discouraged to apply for promotions and lost them to less qualified male colleagues when they did. The agency said that they also had to endure unwelcome sexual advances and faced retaliation when they spoke up. Female employees were given negative performance reviews, were denied opportunities and, ultimately, were terminated."" https://finance.yahoo.com/news/snap-will-pay-15-million-to-settle-california-lawsuit-alleging-sexual-discrimination-120019788.html

""Civil Rights Department Obtains $15 Million Settlement Agreement with Snapchat Over Alleged Sex-Based Employment Discrimination
June 19, 2024
For Immediate Release
The California Civil Rights Department (CRD) today announced obtaining a $15 million settlement agreement with Snap Inc. — known for the Snapchat social media platform — over alleged discrimination, harassment, and retaliation against women at the company. As part of the agreement, which is subject to court approval, Snap Inc. has committed to taking action to help ensure the implementation of fair employment practices and provide monetary relief to women who were employees at the company in California between 2014 and 2024."" https://calcivilrights.ca.gov/2024/06/19/civil-rights-department-obtains-15-million-settlement-agreement-with-snapchat-over-alleged-sex-based-employment-discrimination/"
MSFT.OQ;US5949181045;594918104;Microsoft Corp;United States of America;Information Technology;Software & Services;03-07-2024;03-07-2025;"Settlement for Intersectional Discrimination - ""The California Civil Rights Department (CRD) today announced reaching a $14,425,000 proposed settlement with the Microsoft Corporation to resolve allegations of retaliation and discrimination against workers based on their use of protected leave, including parental, disability, pregnancy, and family care taking leave. State and federal law prohibits employers from interfering with an employee’s use of protected forms of leave, such as leave to bond with a new child, address a serious health condition, or care for a family member. As part of the settlement, which is subject to court approval, Microsoft has committed to taking a range of proactive steps to prevent future discrimination and provide monetary relief to employees who used protected leave at the company in California between 2017 and 2024. [...] If approved by the court, the settlement will require Microsoft to:
Pay $14,200,000 to cover direct relief for workers and $225,000 in costs associated with the department’s enforcement efforts.
Retain an independent consultant to make recommendations on Microsoft’s personnel policies and practices to ensure managers do not consider time on protected leave in determining annual rewards and promotions.
Work with the independent consultant to also ensure workers know how to raise complaints in instances where they believe that annual rewards and promotion decisions reflect discrimination or retaliation for the use of protected leave.
Report annually, via the independent consultant, on compliance with the settlement, including with respect to how complaints of discrimination are received and processed.
Ensure managers and human resources personnel complete training concerning prohibitions on discrimination based on the use of protected leave."" https://calcivilrights.ca.gov/2024/07/03/civil-rights-department-reaches-14-4-million-settlement-with-microsoft-over-alleged-parental-and-disability-leave-discrimination/

Microsoft reached a $14.4 million settlement with California’s Civil Rights Department to resolve claims that it discriminated and retaliated against women and disabled workers when they took protective leave.
The department said that, during its four-year investigation, it found that Microsoft gave lower bonuses and unfavorable performance reviews to workers who used protected leave, reducing their chances of getting promotions and stock awards. Protected leave gives workers rights to time off for pregnancy, disability, family care, and parental reasons without being retaliated against. 
[...] The overwhelming majority of the settlement — $14.2 million — will be paid as direct relief to Microsoft workers in California who were impacted by the alleged issue between 2017 and 2024. Microsoft also committed to taking “range of proactive steps to prevent future discrimination,” CRD said. That includes more training for managers over workers’ rights to protected leave and hiring an independent consultant every year to assess whether it’s complying with the terms of the settlement, among others."" https://qz.com/microsoft-settle-14-million-disability-discrimination-c-1851575836
"
CAT.N;US1491231015;149123101;Caterpillar Inc;United States of America;Industrials;Capital Goods;22-07-2024;22-07-2025;"Official Ruling for Gender Pay Discrimination - ""[Caterpillar Inc is the parent company of Caterpillar NI] Belfast woman Shona Boyle, an employee of Caterpillar NI, has been awarded more than £305,000 in compensation in what is believed to be the highest individual equal pay claim in Northern Ireland’s history. The landmark ruling is being seen as underlining the importance of gender pay equality and sets a precedent for future claims. Ms Boyle initiated her claim against the US multinational in July 2018, after discovering significant pay discrepancies between herself and three male colleagues who were performing the same job.
[...] An employment tribunal overwhelmingly determined that Ms Boyle was indeed performing the same job as her male colleagues who were paid more and that the pay disparity was due to her being a woman. The employment judge concluded that the claimant was engaged in like work to her three male comparators, and any differences were not of practical importance un relation to the terms and conditions of employment. It said Caterpillar did not prove that the variation between Ms Boyle’s contract and those of her comparators “was genuinely due to a material factor which is not tainted by sex”.
[...] Consequently, she was awarded back pay for the period she was underpaid and ensured equal pay and benefits moving forward.
With interest added on from the outset of the tribunal, the total settlement came in at £305,719."" https://www.irishnews.com/news/business/belfast-woman-awarded-305000-in-historic-equal-pay-victory-U3XTHPXUPVHQPKFB4XOGIH2FTA/"