2025-12-04 10:40:32,779 - werkzeug - WARNING -  * Debugger is active!
2025-12-04 10:40:32,781 - werkzeug - INFO -  * Debugger PIN: 691-175-853
2025-12-04 10:40:35,839 - werkzeug - INFO - 127.0.0.1 - - [04/Dec/2025 10:40:35] "POST /calculate HTTP/1.1" 200 -
2025-12-04 10:40:35,839 - Review.reviews.eesl_review - INFO - Starting EESL review calculation
2025-12-04 10:40:35,857 - werkzeug - INFO - 127.0.0.1 - - [04/Dec/2025 10:40:35] "GET /task-status/f2a1ae7e-6a01-4b50-bc99-bd2f127703d8 HTTP/1.1" 200 -
2025-12-04 10:40:37,854 - werkzeug - INFO - 127.0.0.1 - - [04/Dec/2025 10:40:37] "GET /task-status/f2a1ae7e-6a01-4b50-bc99-bd2f127703d8 HTTP/1.1" 200 -
2025-12-04 10:40:39,000 - Review.reviews.eesl_review - INFO - Found 0 existing companies in EESL
2025-12-04 10:40:39,005 - Review.reviews.eesl_review - INFO - 
EESL Selection Summary by Country:
2025-12-04 10:40:39,011 - Review.reviews.eesl_review - INFO - Austria: 12 total (0 existing, 12 new)
2025-12-04 10:40:39,012 - Review.reviews.eesl_review - INFO - Belgium: 21 total (0 existing, 21 new)
2025-12-04 10:40:39,016 - Review.reviews.eesl_review - INFO - Denmark: 23 total (0 existing, 23 new)
2025-12-04 10:40:39,019 - Review.reviews.eesl_review - INFO - Finland: 36 total (0 existing, 36 new)
2025-12-04 10:40:39,024 - Review.reviews.eesl_review - INFO - France: 80 total (0 existing, 80 new)
2025-12-04 10:40:39,027 - Review.reviews.eesl_review - INFO - Germany: 88 total (0 existing, 88 new)
2025-12-04 10:40:39,029 - Review.reviews.eesl_review - INFO - Great Britain: 199 total (0 existing, 199 new)
2025-12-04 10:40:39,030 - Review.reviews.eesl_review - INFO - Ireland: 8 total (0 existing, 8 new)
2025-12-04 10:40:39,032 - Review.reviews.eesl_review - INFO - Italy: 56 total (0 existing, 56 new)
2025-12-04 10:40:39,035 - Review.reviews.eesl_review - INFO - Netherlands: 37 total (0 existing, 37 new)
2025-12-04 10:40:39,038 - Review.reviews.eesl_review - INFO - Norway: 74 total (0 existing, 74 new)
2025-12-04 10:40:39,042 - Review.reviews.eesl_review - INFO - Portugal: 8 total (0 existing, 8 new)
2025-12-04 10:40:39,044 - Review.reviews.eesl_review - INFO - Spain: 35 total (0 existing, 35 new)
2025-12-04 10:40:39,047 - Review.reviews.eesl_review - INFO - Sweden: 154 total (0 existing, 154 new)
2025-12-04 10:40:39,047 - Review.reviews.eesl_review - INFO - Switzerland: 73 total (0 existing, 73 new)
2025-12-04 10:40:39,047 - Review.reviews.eesl_review - INFO - 
Overall EESL Selection Summary:
2025-12-04 10:40:39,047 - Review.reviews.eesl_review - INFO - Total companies selected: 904
2025-12-04 10:40:39,050 - Review.reviews.eesl_review - INFO -   - Existing companies selected: 0
2025-12-04 10:40:39,050 - Review.reviews.eesl_review - INFO -   - New companies selected: 904
2025-12-04 10:40:39,051 - Review.reviews.eesl_review - INFO - Total FFMC covered: 13.39%
2025-12-04 10:40:39,051 - Review.reviews.eesl_review - INFO - 
Applying proportional capping
2025-12-04 10:40:39,052 - utils.capping_proportional - INFO - Starting proportional capping with max weight: 10.0%
2025-12-04 10:40:39,053 - utils.capping_proportional - INFO - Capping procedure converged after 0 iterations
2025-12-04 10:40:39,053 - utils.capping_proportional - INFO - Capping Summary:
2025-12-04 10:40:39,053 - utils.capping_proportional - INFO -   Total companies: 904
2025-12-04 10:40:39,054 - utils.capping_proportional - INFO -   Companies capped: 0
2025-12-04 10:40:39,054 - utils.capping_proportional - INFO -   Weight sum after capping: 1.000000
2025-12-04 10:40:39,054 - utils.capping_proportional - INFO -   Max weight after capping: 0.013324
2025-12-04 10:40:39,061 - Review.reviews.eesl_review - INFO - 
EESL Changes Summary:
2025-12-04 10:40:39,061 - Review.reviews.eesl_review - INFO - Inclusions: 904
2025-12-04 10:40:39,061 - Review.reviews.eesl_review - INFO - Exclusions: 0
2025-12-04 10:40:39,061 - Review.reviews.eesl_review - INFO - Saving output to: C:\Users\CSonneveld\OneDrive - Euronext\Documents\Projects\GUI + Reviews\output\EESL_Review_20251204_104039.xlsx
2025-12-04 10:40:39,404 - Review.reviews.eesl_review - INFO - File successfully saved to: C:\Users\CSonneveld\OneDrive - Euronext\Documents\Projects\GUI + Reviews\output\EESL_Review_20251204_104039.xlsx
2025-12-04 10:40:39,857 - werkzeug - INFO - 127.0.0.1 - - [04/Dec/2025 10:40:39] "GET /task-status/f2a1ae7e-6a01-4b50-bc99-bd2f127703d8 HTTP/1.1" 200 -
2025-12-04 10:40:45,122 - werkzeug - INFO - 127.0.0.1 - - [04/Dec/2025 10:40:45] "POST /calculate HTTP/1.1" 200 -
2025-12-04 10:40:45,122 - Review.reviews.ewms_review - INFO - Starting EWMS review calculation
2025-12-04 10:40:45,122 - werkzeug - INFO - 127.0.0.1 - - [04/Dec/2025 10:40:45] "GET /task-status/08547de3-038f-47ae-b92d-87279ca7c36c HTTP/1.1" 200 -
2025-12-04 10:40:46,921 - Review.reviews.ewms_review - INFO - Found 0 existing companies in EWMS
2025-12-04 10:40:46,921 - Review.reviews.ewms_review - INFO - 
EWMS Selection Summary by Country:
2025-12-04 10:40:46,930 - Review.reviews.ewms_review - INFO - Australia: 257 total (0 existing, 257 new)
2025-12-04 10:40:46,934 - Review.reviews.ewms_review - INFO - Austria: 15 total (0 existing, 15 new)
2025-12-04 10:40:46,936 - Review.reviews.ewms_review - INFO - Belgium: 29 total (0 existing, 29 new)
2025-12-04 10:40:46,940 - Review.reviews.ewms_review - INFO - Canada: 187 total (0 existing, 187 new)
2025-12-04 10:40:46,942 - Review.reviews.ewms_review - INFO - Denmark: 30 total (0 existing, 30 new)
2025-12-04 10:40:46,942 - Review.reviews.ewms_review - INFO - Finland: 42 total (0 existing, 42 new)
2025-12-04 10:40:46,950 - Review.reviews.ewms_review - INFO - France: 80 total (0 existing, 80 new)
2025-12-04 10:40:46,953 - Review.reviews.ewms_review - INFO - Germany: 86 total (0 existing, 86 new)
2025-12-04 10:40:46,956 - Review.reviews.ewms_review - INFO - Great Britain: 246 total (0 existing, 246 new)
2025-12-04 10:40:46,960 - Review.reviews.ewms_review - INFO - Hong Kong: 75 total (0 existing, 75 new)
2025-12-04 10:40:46,962 - Review.reviews.ewms_review - INFO - Ireland: 9 total (0 existing, 9 new)
2025-12-04 10:40:46,967 - Review.reviews.ewms_review - INFO - Israel: 134 total (0 existing, 134 new)
2025-12-04 10:40:46,968 - Review.reviews.ewms_review - INFO - Italy: 69 total (0 existing, 69 new)
2025-12-04 10:40:46,974 - Review.reviews.ewms_review - INFO - Japan: 1274 total (0 existing, 1274 new)
2025-12-04 10:40:46,977 - Review.reviews.ewms_review - INFO - Netherlands: 40 total (0 existing, 40 new)
2025-12-04 10:40:46,980 - Review.reviews.ewms_review - INFO - New Zealand: 28 total (0 existing, 28 new)
2025-12-04 10:40:46,983 - Review.reviews.ewms_review - INFO - Norway: 93 total (0 existing, 93 new)
2025-12-04 10:40:46,986 - Review.reviews.ewms_review - INFO - Portugal: 9 total (0 existing, 9 new)
2025-12-04 10:40:46,990 - Review.reviews.ewms_review - INFO - Singapore: 64 total (0 existing, 64 new)
2025-12-04 10:40:46,992 - Review.reviews.ewms_review - INFO - Spain: 36 total (0 existing, 36 new)
2025-12-04 10:40:46,992 - Review.reviews.ewms_review - INFO - Sweden: 193 total (0 existing, 193 new)
2025-12-04 10:40:47,000 - Review.reviews.ewms_review - INFO - Switzerland: 81 total (0 existing, 81 new)
2025-12-04 10:40:47,004 - Review.reviews.ewms_review - INFO - United States: 1706 total (0 existing, 1706 new)
2025-12-04 10:40:47,004 - Review.reviews.ewms_review - INFO - 
Overall EWMS Selection Summary:
2025-12-04 10:40:47,004 - Review.reviews.ewms_review - INFO - Total companies selected: 4783
2025-12-04 10:40:47,005 - Review.reviews.ewms_review - INFO -   - Existing companies selected: 0
2025-12-04 10:40:47,006 - Review.reviews.ewms_review - INFO -   - New companies selected: 4783
2025-12-04 10:40:47,006 - Review.reviews.ewms_review - INFO - Total FFMC covered: 28.29%
2025-12-04 10:40:47,008 - Review.reviews.ewms_review - INFO - 
Applying proportional capping
2025-12-04 10:40:47,009 - utils.capping_proportional - INFO - Starting proportional capping with max weight: 10.0%
2025-12-04 10:40:47,010 - utils.capping_proportional - INFO - Capping procedure converged after 0 iterations
2025-12-04 10:40:47,011 - utils.capping_proportional - INFO - Capping Summary:
2025-12-04 10:40:47,011 - utils.capping_proportional - INFO -   Total companies: 4783
2025-12-04 10:40:47,011 - utils.capping_proportional - INFO -   Companies capped: 0
2025-12-04 10:40:47,011 - utils.capping_proportional - INFO -   Weight sum after capping: 1.000000
2025-12-04 10:40:47,011 - utils.capping_proportional - INFO -   Max weight after capping: 0.003131
2025-12-04 10:40:47,024 - Review.reviews.ewms_review - INFO - 
EWMS Changes Summary:
2025-12-04 10:40:47,024 - Review.reviews.ewms_review - INFO - Inclusions: 4783
2025-12-04 10:40:47,025 - Review.reviews.ewms_review - INFO - Exclusions: 0
2025-12-04 10:40:47,025 - Review.reviews.ewms_review - INFO - Saving output to: C:\Users\CSonneveld\OneDrive - Euronext\Documents\Projects\GUI + Reviews\output\EWMS_Review_20251204_104047.xlsx
2025-12-04 10:40:47,188 - werkzeug - INFO - 127.0.0.1 - - [04/Dec/2025 10:40:47] "GET /task-status/08547de3-038f-47ae-b92d-87279ca7c36c HTTP/1.1" 200 -
2025-12-04 10:40:48,210 - Review.reviews.ewms_review - INFO - File successfully saved to: C:\Users\CSonneveld\OneDrive - Euronext\Documents\Projects\GUI + Reviews\output\EWMS_Review_20251204_104047.xlsx
2025-12-04 10:40:49,129 - werkzeug - INFO - 127.0.0.1 - - [04/Dec/2025 10:40:49] "GET /task-status/08547de3-038f-47ae-b92d-87279ca7c36c HTTP/1.1" 200 -
2025-12-04 10:40:55,909 - werkzeug - INFO -  * Detected change in 'C:\\Users\\CSonneveld\\OneDrive - Euronext\\Documents\\Projects\\GUI + Reviews\\Review\\reviews\\eesl_review.py', reloading
2025-12-04 10:40:55,909 - werkzeug - INFO -  * Detected change in 'C:\\Users\\CSonneveld\\OneDrive - Euronext\\Documents\\Projects\\GUI + Reviews\\Review\\reviews\\eesl_review.py', reloading
