2025-12-04 10:36:45,065 - werkzeug - WARNING -  * Debugger is active!
2025-12-04 10:36:45,068 - werkzeug - INFO -  * Debugger PIN: 691-175-853
2025-12-04 10:36:45,303 - werkzeug - INFO - 127.0.0.1 - - [04/Dec/2025 10:36:45] "GET /task-status/ac065646-9aef-4dbe-8228-4c4e4fb961ac HTTP/1.1" 200 -
2025-12-04 10:36:46,235 - werkzeug - INFO - 127.0.0.1 - - [04/Dec/2025 10:36:46] "POST /calculate HTTP/1.1" 200 -
2025-12-04 10:36:46,252 - Review.reviews.eusl_review - INFO - Starting EUSL review calculation
2025-12-04 10:36:46,252 - werkzeug - INFO - 127.0.0.1 - - [04/Dec/2025 10:36:46] "GET /task-status/889f76e8-2f1b-4829-bd46-1043703e2507 HTTP/1.1" 200 -
2025-12-04 10:36:47,885 - Review.reviews.eusl_review - INFO - Found 0 existing companies in EUSL
2025-12-04 10:36:47,901 - Review.reviews.eusl_review - INFO - 
EUSL Selection Summary by Country:
2025-12-04 10:36:47,903 - Review.reviews.eusl_review - INFO - United States: 1048 total (0 existing, 1048 new)
2025-12-04 10:36:47,903 - Review.reviews.eusl_review - INFO - 
Overall EUSL Selection Summary:
2025-12-04 10:36:47,903 - Review.reviews.eusl_review - INFO - Total companies selected: 1048
2025-12-04 10:36:47,905 - Review.reviews.eusl_review - INFO -   - Existing companies selected: 0
2025-12-04 10:36:47,905 - Review.reviews.eusl_review - INFO -   - New companies selected: 1048
2025-12-04 10:36:47,906 - Review.reviews.eusl_review - INFO - Total FFMC covered: 13.03%
2025-12-04 10:36:47,906 - Review.reviews.eusl_review - INFO - 
Applying proportional capping
2025-12-04 10:36:47,906 - utils.capping_proportional - INFO - Starting proportional capping with max weight: 10.0%
2025-12-04 10:36:47,907 - utils.capping_proportional - INFO - Capping procedure converged after 0 iterations
2025-12-04 10:36:47,909 - utils.capping_proportional - INFO - Capping Summary:
2025-12-04 10:36:47,909 - utils.capping_proportional - INFO -   Total companies: 1048
2025-12-04 10:36:47,909 - utils.capping_proportional - INFO -   Companies capped: 0
2025-12-04 10:36:47,909 - utils.capping_proportional - INFO -   Weight sum after capping: 1.000000
2025-12-04 10:36:47,909 - utils.capping_proportional - INFO -   Max weight after capping: 0.002926
2025-12-04 10:36:47,915 - Review.reviews.eusl_review - INFO - 
EUSL Changes Summary:
2025-12-04 10:36:47,915 - Review.reviews.eusl_review - INFO - Inclusions: 1048
2025-12-04 10:36:47,915 - Review.reviews.eusl_review - INFO - Exclusions: 0
2025-12-04 10:36:47,918 - Review.reviews.eusl_review - INFO - Saving output to: C:\Users\CSonneveld\OneDrive - Euronext\Documents\Projects\GUI + Reviews\output\EUSL_Review_20251204_103647.xlsx
2025-12-04 10:36:48,262 - werkzeug - INFO - 127.0.0.1 - - [04/Dec/2025 10:36:48] "GET /task-status/889f76e8-2f1b-4829-bd46-1043703e2507 HTTP/1.1" 200 -
2025-12-04 10:36:48,274 - Review.reviews.eusl_review - INFO - File successfully saved to: C:\Users\CSonneveld\OneDrive - Euronext\Documents\Projects\GUI + Reviews\output\EUSL_Review_20251204_103647.xlsx
2025-12-04 10:36:50,258 - werkzeug - INFO - 127.0.0.1 - - [04/Dec/2025 10:36:50] "GET /task-status/889f76e8-2f1b-4829-bd46-1043703e2507 HTTP/1.1" 200 -
2025-12-04 10:36:54,486 - werkzeug - INFO - 127.0.0.1 - - [04/Dec/2025 10:36:54] "POST /calculate HTTP/1.1" 200 -
2025-12-04 10:36:54,486 - Review.reviews.eums_review - INFO - Starting EUMS review calculation
2025-12-04 10:36:54,486 - werkzeug - INFO - 127.0.0.1 - - [04/Dec/2025 10:36:54] "GET /task-status/80c02705-9f24-4fc6-ac73-59cc5019d642 HTTP/1.1" 200 -
2025-12-04 10:36:56,264 - Review.reviews.eums_review - INFO - Found 0 existing companies in EUMS
2025-12-04 10:36:56,269 - Review.reviews.eums_review - INFO - 
EUMS Selection Summary by Country:
2025-12-04 10:36:56,270 - Review.reviews.eums_review - INFO - United States: 1272 total (0 existing, 1272 new)
2025-12-04 10:36:56,270 - Review.reviews.eums_review - INFO - 
Overall EUMS Selection Summary:
2025-12-04 10:36:56,270 - Review.reviews.eums_review - INFO - Total companies selected: 1272
2025-12-04 10:36:56,271 - Review.reviews.eums_review - INFO -   - Existing companies selected: 0
2025-12-04 10:36:56,271 - Review.reviews.eums_review - INFO -   - New companies selected: 1272
2025-12-04 10:36:56,272 - Review.reviews.eums_review - INFO - Total FFMC covered: 28.08%
2025-12-04 10:36:56,272 - Review.reviews.eums_review - INFO - 
Applying proportional capping
2025-12-04 10:36:56,273 - Review.reviews.eums_review - INFO - 
=== SELECTION DEBUGGING ===
2025-12-04 10:36:56,273 - Review.reviews.eums_review - INFO - Total universe size: 1418
2025-12-04 10:36:56,273 - Review.reviews.eums_review - INFO - Companies with EUMS_selection == 1: 1272
2025-12-04 10:36:56,274 - Review.reviews.eums_review - INFO - Companies with Is_Existing == 1: 0
2025-12-04 10:36:56,274 - Review.reviews.eums_review - INFO - 
Existing companies meeting 68% threshold: 0
2025-12-04 10:36:56,274 - Review.reviews.eums_review - INFO - New companies meeting 72% threshold: 1272
2025-12-04 10:36:56,274 - Review.reviews.eums_review - INFO - 
NaN values in key columns:
2025-12-04 10:36:56,274 - Review.reviews.eums_review - INFO -   Country: 0
2025-12-04 10:36:56,275 - Review.reviews.eums_review - INFO -   Mcap in EUR: 0
2025-12-04 10:36:56,275 - Review.reviews.eums_review - INFO -   Country_Cumulative_Percentage: 0
2025-12-04 10:36:56,275 - Review.reviews.eums_review - INFO - 
Sample of selection logic:
2025-12-04 10:36:56,279 - Review.reviews.eums_review - INFO - 
                   Company        Country  Is_Existing   Mcap in EUR  Country_Cumulative_Percentage  EUMS_selection
933            NVIDIA CORP  United States            0  3.127089e+12                       6.977338               0
855         MICROSOFT CORP  United States            0  2.714774e+12                      13.034696               0
96                   APPLE  United States            0  2.433759e+12                      18.465036               0
59                  AMAZON  United States            0  1.581563e+12                      21.993910               0
847       META PLTFORM ORD  United States            0  1.178781e+12                      24.624072               0
214          BROADCOM INC.  United States            0  9.956822e+11                      26.845695               0
56        ALPHABET CLASS A  United States            0  8.631987e+11                      28.771713               0
57        ALPHABET INC - C  United States            0  7.678226e+11                      30.484922               0
1238             TESLA INC  United States            0  6.712056e+11                      31.982554               0
723   JP MORGAN CHASE & CO  United States            0  5.865328e+11                      33.291260               0
174   BERKSHIRE HATHAWAY B  United States            0  4.728103e+11                      34.346221               0
1343              VISA INC  United States            0  4.281389e+11                      35.301508               0
451       ELI LILLY AND CO  United States            0  4.122487e+11                      36.221341               0
899           NETFLIX INC.  United States            0  3.685781e+11                      37.043734               0
827         MASTERCARD INC  United States            0  3.482735e+11                      37.820821               0
500            EXXON MOBIL  United States            0  3.415958e+11                      38.583009               0
720      JOHNSON & JOHNSON  United States            0  3.109055e+11                      39.276719               0
359   COSTCO WHOLES. CORP.  United States            0  3.060809e+11                      39.959664               0
1355           WALMART INC  United States            0  3.060224e+11                      40.642478               0
645         HOME DEPOT INC  United States            0  2.957166e+11                      41.302298               0
2025-12-04 10:36:56,279 - utils.capping_proportional - INFO - Starting proportional capping with max weight: 10.0%
2025-12-04 10:36:56,280 - utils.capping_proportional - INFO - Capping procedure converged after 0 iterations
2025-12-04 10:36:56,281 - utils.capping_proportional - INFO - Capping Summary:
2025-12-04 10:36:56,281 - utils.capping_proportional - INFO -   Total companies: 1272
2025-12-04 10:36:56,281 - utils.capping_proportional - INFO -   Companies capped: 0
2025-12-04 10:36:56,281 - utils.capping_proportional - INFO -   Weight sum after capping: 1.000000
2025-12-04 10:36:56,281 - utils.capping_proportional - INFO -   Max weight after capping: 0.004299
2025-12-04 10:36:56,289 - Review.reviews.eums_review - INFO - 
EUMS Changes Summary:
2025-12-04 10:36:56,289 - Review.reviews.eums_review - INFO - Inclusions: 1272
2025-12-04 10:36:56,290 - Review.reviews.eums_review - INFO - Exclusions: 0
2025-12-04 10:36:56,290 - Review.reviews.eums_review - INFO - Saving output to: C:\Users\CSonneveld\OneDrive - Euronext\Documents\Projects\GUI + Reviews\output\EUMS_Review_20251204_103656.xlsx
2025-12-04 10:36:56,502 - werkzeug - INFO - 127.0.0.1 - - [04/Dec/2025 10:36:56] "GET /task-status/80c02705-9f24-4fc6-ac73-59cc5019d642 HTTP/1.1" 200 -
2025-12-04 10:36:56,602 - Review.reviews.eums_review - INFO - File successfully saved to: C:\Users\CSonneveld\OneDrive - Euronext\Documents\Projects\GUI + Reviews\output\EUMS_Review_20251204_103656.xlsx
2025-12-04 10:36:58,486 - werkzeug - INFO - 127.0.0.1 - - [04/Dec/2025 10:36:58] "GET /task-status/80c02705-9f24-4fc6-ac73-59cc5019d642 HTTP/1.1" 200 -
2025-12-04 10:37:15,477 - werkzeug - INFO -  * Detected change in 'C:\\Users\\CSonneveld\\OneDrive - Euronext\\Documents\\Projects\\GUI + Reviews\\config.py', reloading
